{
  "$schema": "../schema/truth.schema.json",
  "schemaVersion": 2,
  "trackId": "d98aff97379fbb9f0f750968b1c5a5bd99cfbc606ad3ef3373197a43eff2d06e",
  "coverage": "none",
  "review": {
    "status": "review-queue",
    "source": "unknown",
    "notes": "v20 prediction 待用户实际试听；禁止直接复制 prediction 作为 truth。"
  },
  "sections": []
}
